Estado;Instituição;Hospital;Curso;Colocação;Nome_Aprovado
MARANHÃO;UDI - UDI Hospital;UDI HOSPITAL;CLÍNICA MÉDICA;1;Emanuelle Almeida Dos Santos
MARANHÃO;UDI - UDI Hospital;UDI HOSPITAL;CLÍNICA MÉDICA;2;Isadora Louise Silva Ferreira
MARANHÃO;UDI - UDI Hospital;UDI HOSPITAL;RADIOLOGIA E DIAGNÓSTICO POR IMAGEM;1;Joao De Oliveira Castro Junior
MARANHÃO;UDI - UDI Hospital;UDI HOSPITAL;RADIOLOGIA E DIAGNÓSTICO POR IMAGEM;2;Samuel Luciano Gomes Aita
MARANHÃO;UDI - UDI Hospital;UDI HOSPITAL;CARDIOLOGIA;1;Fabricio De Flores Barbosa
MARANHÃO;UDI - UDI Hospital;UDI HOSPITAL;MEDICINA INTENSIVA;1;Ruy Sampaio De Siqueira Neto
